{
  "$schema": "https://json-schema.org/draft/2020-12/schema",
  "$id": "https://websitemcp.inferise.com/schema/1.0/binding.json",
  "title": "WebSiteMCP Binding",
  "description": "The binding format: a recording that implements a contract's tools for one site, the private, site-specific how. Lives beside the site's manifest at domain/<reverse-DNS path>/<contract>@<version>.json.",
  "type": "object",
  "additionalProperties": false,
  "required": ["kind", "contract", "satisfiesContract", "version", "tools"],
  "properties": {
    "$schema": { "type": "string", "description": "Optional URL of the schema this file follows." },
    "kind": { "const": "binding", "description": "Marks this file as a binding." },
    "contract": {
      "type": "string",
      "pattern": "^[a-z][a-z0-9]*$",
      "description": "Which contract this binding implements; matches the filename before `@`."
    },
    "satisfiesContract": {
      "$ref": "#/$defs/semver",
      "description": "The exact contract version this recording implements; must equal the manifest's pin."
    },
    "version": {
      "$ref": "#/$defs/semver",
      "description": "The binding version; bump it whenever the recording changes. Matches `@<version>` in the filename."
    },
    "tools": {
      "type": "object",
      "description": "One recording per tool this site implements, keyed by tool id; these are the site's live tools.",
      "minProperties": 1,
      "propertyNames": { "type": "string", "pattern": "^[a-z][a-zA-Z0-9]*$" },
      "additionalProperties": { "$ref": "#/$defs/recording" }
    }
  },
  "$defs": {
    "semver": { "type": "string", "pattern": "^[0-9]+\\.[0-9]+$" },

    "recording": {
      "type": "object",
      "description": "The steps that carry out one tool, plus the rules that map page failures to contract errors.",
      "additionalProperties": false,
      "required": ["steps"],
      "properties": {
        "steps": {
          "type": "array",
          "minItems": 1,
          "items": { "$ref": "#/$defs/step" }
        },
        "errors": {
          "type": "array",
          "description": "Rules mapping a recognized page failure to one of the tool's contract error codes.",
          "items": { "$ref": "#/$defs/errorRule" }
        }
      }
    },

    "step": {
      "type": "object",
      "description": "One recorded action; the `action` field selects which other fields apply.",
      "required": ["action"],
      "properties": {
        "action": {
          "enum": ["navigate", "click", "input", "select", "submit", "waitFor", "assert", "read"]
        },
        "note": { "type": "string", "description": "Optional human label for the step, kept from recording time." },
        "url": { "type": "string", "description": "Where to navigate; may contain {{token}} placeholders naming inputSchema properties." },
        "target": {
          "$ref": "#/$defs/locatorSet",
          "description": "Which element to act on, as an ordered list of fallback locators."
        },
        "value": {
          "type": "string",
          "description": "Text to type or option to pick; use a {{token}} naming an inputSchema property to inject a tool input."
        },
        "wait": {
          "$ref": "#/$defs/waitCondition",
          "description": "A condition to satisfy before this step runs (or the whole point of a `waitFor` step)."
        },
        "assert": {
          "$ref": "#/$defs/assertion",
          "description": "A condition that must hold, or the step fails."
        },
        "extract": {
          "$ref": "#/$defs/extraction",
          "description": "Reads a value from the page into a named result field."
        }
      },
      "allOf": [
        { "if": { "properties": { "action": { "const": "navigate" } } }, "then": { "required": ["url"] } },
        { "if": { "properties": { "action": { "const": "click" } } }, "then": { "required": ["target"] } },
        { "if": { "properties": { "action": { "const": "input" } } }, "then": { "required": ["target", "value"] } },
        { "if": { "properties": { "action": { "const": "select" } } }, "then": { "required": ["target", "value"] } },
        { "if": { "properties": { "action": { "const": "submit" } } }, "then": { "required": ["target"] } },
        { "if": { "properties": { "action": { "const": "waitFor" } } }, "then": { "required": ["wait"] } },
        { "if": { "properties": { "action": { "const": "assert" } } }, "then": { "required": ["assert"] } },
        { "if": { "properties": { "action": { "const": "read" } } }, "then": { "required": ["target", "extract"] } }
      ]
    },

    "locatorSet": {
      "type": "object",
      "additionalProperties": false,
      "required": ["locators"],
      "properties": {
        "locators": {
          "type": "array",
          "description": "Fallback locators tried in order until one matches a unique element; list them most-resilient first (role/testid) to most brittle (css/xpath).",
          "minItems": 1,
          "items": { "$ref": "#/$defs/locator" }
        }
      }
    },

    "locator": {
      "type": "object",
      "additionalProperties": false,
      "required": ["strategy", "value"],
      "properties": {
        "strategy": {
          "enum": ["role", "testid", "label", "text", "css", "xpath"],
          "description": "How to find the element: ARIA role, test attribute, form label, visible text, or a raw css/xpath selector."
        },
        "value": {
          "type": "string",
          "description": "The selector or value for the chosen strategy (e.g. css `#amount`)."
        },
        "name": {
          "type": "string",
          "description": "Extra qualifier, such as an element's accessible name."
        }
      }
    },

    "waitCondition": {
      "type": "object",
      "additionalProperties": false,
      "required": ["type"],
      "properties": {
        "type": {
          "enum": ["selector", "selectorGone", "url", "networkIdle", "timeout"],
          "description": "What to wait on: an element appearing or disappearing, a URL match, network idle, or a fixed delay."
        },
        "target": { "$ref": "#/$defs/locatorSet", "description": "The element to wait on, for `selector` / `selectorGone`." },
        "url": { "type": "string", "description": "The URL or pattern to wait for, for type `url`; may contain {{token}} placeholders naming inputSchema properties." },
        "timeoutMs": { "type": "integer", "minimum": 0, "description": "How long to wait before failing (or the delay, for type `timeout`)." }
      }
    },

    "assertion": {
      "type": "object",
      "additionalProperties": false,
      "required": ["type"],
      "properties": {
        "type": {
          "enum": ["visible", "absent", "textEquals", "textContains", "urlMatches"]
        },
        "target": { "$ref": "#/$defs/locatorSet" },
        "value": { "type": "string", "description": "The expected text or URL to check; may contain {{token}} placeholders naming inputSchema properties." }
      }
    },

    "extraction": {
      "type": "object",
      "additionalProperties": false,
      "required": ["field", "from"],
      "properties": {
        "field": {
          "type": "string",
          "description": "Which result field this value fills; must be one of the tool's returns."
        },
        "from": {
          "enum": ["text", "value", "attribute"],
          "description": "Where on the element to read: its visible text, form value, or an attribute."
        },
        "attribute": { "type": "string", "description": "Which attribute to read, when `from` is `attribute`." },
        "as": {
          "enum": ["string", "number", "integer", "boolean"],
          "description": "Convert the captured text to this type."
        }
      }
    },

    "errorRule": {
      "type": "object",
      "additionalProperties": false,
      "required": ["when", "raise"],
      "properties": {
        "when": {
          "type": "object",
          "additionalProperties": false,
          "description": "The page condition that signals this error; give exactly one form.",
          "properties": {
            "selectorVisible": { "$ref": "#/$defs/locatorSet" },
            "textContains": { "type": "string" },
            "stepTimeout": { "type": "boolean" },
            "urlMatches": { "type": "string" }
          }
        },
        "raise": {
          "type": "string",
          "pattern": "^[A-Z][A-Z0-9_]*$",
          "description": "The contract error code to return when the condition matches."
        }
      }
    }
  }
}
