{
  "$schema": "https://websitemcp.inferise.com/schema/1.0/binding.json",
  "kind": "binding",
  "contract": "bank",
  "satisfiesContract": "1.0",
  "version": "1.0",
  "tools": {
    "checkBalance": {
      "steps": [
        {
          "action": "navigate",
          "url": "https://www.svb.com/accounts",
          "wait": { "type": "networkIdle", "timeoutMs": 15000 }
        },
        {
          "action": "read",
          "note": "Available balance for the requested account row.",
          "target": {
            "locators": [
              { "strategy": "testid", "value": "account-balance" },
              { "strategy": "role", "value": "cell", "name": "Available balance" },
              { "strategy": "css", "value": ".account-summary .balance" }
            ]
          },
          "extract": { "field": "balance", "from": "text", "as": "number" }
        },
        {
          "action": "read",
          "target": {
            "locators": [
              { "strategy": "testid", "value": "account-currency" },
              { "strategy": "css", "value": ".account-summary .currency" }
            ]
          },
          "extract": { "field": "currency", "from": "text", "as": "string" }
        }
      ],
      "errors": [
        {
          "when": { "selectorVisible": { "locators": [ { "strategy": "text", "value": "Account not found" } ] } },
          "raise": "ACCOUNT_NOT_FOUND"
        }
      ]
    },

    "payBill": {
      "steps": [
        {
          "action": "navigate",
          "url": "https://www.svb.com/billpay",
          "wait": { "type": "networkIdle", "timeoutMs": 15000 }
        },
        {
          "action": "select",
          "note": "Payee dropdown.",
          "target": {
            "locators": [
              { "strategy": "label", "value": "Payee" },
              { "strategy": "testid", "value": "billpay-payee" },
              { "strategy": "css", "value": "select[name='payee']" }
            ]
          },
          "value": "{{payee}}"
        },
        {
          "action": "input",
          "target": {
            "locators": [
              { "strategy": "label", "value": "Amount" },
              { "strategy": "testid", "value": "billpay-amount" },
              { "strategy": "css", "value": "input[name='amount']" }
            ]
          },
          "value": "{{amount}}"
        },
        {
          "action": "submit",
          "target": {
            "locators": [
              { "strategy": "role", "value": "button", "name": "Pay bill" },
              { "strategy": "testid", "value": "billpay-submit" }
            ]
          },
          "wait": { "type": "networkIdle", "timeoutMs": 20000 }
        },
        {
          "action": "read",
          "target": {
            "locators": [
              { "strategy": "testid", "value": "confirmation-number" },
              { "strategy": "css", "value": ".confirmation .number" }
            ]
          },
          "extract": { "field": "confirmationId", "from": "text", "as": "string" }
        },
        {
          "action": "read",
          "target": {
            "locators": [
              { "strategy": "testid", "value": "confirmation-status" },
              { "strategy": "css", "value": ".confirmation .status" }
            ]
          },
          "extract": { "field": "status", "from": "text", "as": "string" }
        }
      ],
      "errors": [
        {
          "when": { "selectorVisible": { "locators": [ { "strategy": "text", "value": "Payee not found" } ] } },
          "raise": "PAYEE_NOT_FOUND"
        },
        {
          "when": { "selectorVisible": { "locators": [ { "strategy": "testid", "value": "error-insufficient-funds" } ] } },
          "raise": "INSUFFICIENT_FUNDS"
        }
      ]
    }
  }
}
